{
  "link_id": "spring_sale_2026",
  "purpose": "Spring sale 2026: один smartlink для всіх каналів (TikTok, email, ads).",
  "status": "draft",
  "context_shape": [
    "country",
    "device",
    "utm.source",
    "utm.campaign"
  ],
  "rules": [
    {
      "id": "rule_1",
      "label": "de_tiktok_mobile",
      "when": {
        "country": "DE",
        "device": "mobile",
        "utm": {
          "source": "tiktok"
        }
      },
      "target": "https://example.de/spring/mobile-funnel"
    },
    {
      "id": "rule_2",
      "label": "email_spring_main",
      "when": {
        "utm": {
          "source": "email",
          "campaign": "spring_2026"
        }
      },
      "target": "https://example.com/spring/email-landing"
    },
    {
      "id": "rule_3",
      "label": "de_default",
      "when": {
        "country": "DE"
      },
      "target": "https://example.de/spring/main"
    }
  ],
  "fallback_target": "https://example.com/spring/global-en",
  "meta": {
    "version": 1,
    "created_at": "2025-11-25T11:37:34Z",
    "updated_at": "2025-11-25T11:37:34Z",
    "created_by": "system",
    "updated_by": "system"
  }
}